{
  "installer_type": "stub",
  "installer_version": "63.0a1",
  "build_channel": "nightly",
  "update_channel": "nightly",
  "version": "63.0a1",
  "build_id": "20180816100035",
  "locale": "en-US",
  "64bit_build": true,
  "64bit_os": true,
  "os_version": "10.0.17134",
  "server_os": false,
  "admin_user": true,
  "default_path": true,
  "old_default": true,
  "had_old_install": true,
  "old_version": "63.0a1",
  "old_build_id": "20180816100035",
  "bytes_downloaded": 46201336,
  "download_size": 46201336,
  "download_retries": 0,
  "download_time": 3,
  "download_latency": 0,
  "download_ip": "2600:9000:2145:f400:e:19d6:1546:5981",
  "manual_download": false,
  "options_time": 1,
  "preinstall_time": 0,
  "install_time": 7,
  "finish_time": 1,
  "succeeded": true,
  "new_launched": true,
  "attribution": "campaign%3Dtestcampaign%26content%3Dtestcontent%26medium%3Dtestmedium%26source%3Dmozilla.com",
  "profile_cleanup_prompt": "paveover",
  "profile_cleanup_requested": true
}
