{
  "installer_type": "full",
  "installer_version": "63.0a1",
  "build_channel": "nightly",
  "update_channel": "nightly",
  "version": "63.0a1",
  "build_id": "20180816100035",
  "locale": "en-US",
  "from_msi": true,
  "64bit_build": true,
  "64bit_os": true,
  "os_version": "10.0.17134",
  "server_os": false,
  "admin_user": true,
  "default_path": true,
  "set_default": false,
  "new_default": false,
  "old_default": false,
  "had_old_install": false,
  "intro_time": 2,
  "options_time": 2,
  "install_time": 3,
  "finish_time": 2,
  "succeeded": true,
  "new_launched": false
}
